{
  "formatVersion": 1,
  "game": "minecraft",
  "versionId": "1.0.0",
  "name": "Example Fabric Pack",
  "summary": "A small example pack.",
  "files": [
    {
      "path": "mods/fabric-api-0.92.2+1.20.1.jar",
      "hashes": {
        "sha1": "1111111111111111111111111111111111111111",
        "sha512": "11111111111111111111111111111111111111111111111111111111111111111111111111111111111111111111111111111111111111111111111111111111"
      },
      "env": {
        "client": "required",
        "server": "required"
      },
      "downloads": [
        "https://cdn.modrinth.com/data/P7dR8mSH/versions/11111111/fabric-api-0.92.2%2B1.20.1.jar"
      ],
      "fileSize": 1234567
    }
  ],
  "dependencies": {
    "minecraft": "1.20.1",
    "fabric-loader": "0.15.11"
  }
}
